MariaDB [z1910087]> USE z1910087;
Database changed
MariaDB [z1910087]> CREATE TABLE Taco (
    -> pk INT PRIMARY KEY,
    -> data CHAR(15)
    -> );
Query OK, 0 rows affected (0.211 sec)

MariaDB [z1910087]> START TRANSACTION;
Query OK, 0 rows affected (0.000 sec)

MariaDB [z1910087]> INSERT INTO Taco VALUES(1, 'dataA');
Query OK, 1 row affected (0.001 sec)

MariaDB [z1910087]> INSERT INTO Taco VALUES(2, 'dataB');
Query OK, 1 row affected (0.001 sec)

MariaDB [z1910087]> INSERT INTO Taco VALUES(3, 'dataC');
Query OK, 1 row affected (0.001 sec)

MariaDB [z1910087]> USE z1910087;
Database changed
MariaDB [z1910087]> SELECT * FROM Taco;
Empty set (0.001 sec)

MariaDB [z1910087]> INSERT INTO Taco VALUES(4, 'dataD');
Query OK, 1 row affected (0.076 sec)

MariaDB [z1910087]> INSERT INTO Taco VALUES (5, 'dataE');
Query OK, 1 row affected (0.077 sec)

MariaDB [z1910087]> COMMIT;
Query OK, 0 rows affected (0.000 sec)

MariaDB [z1910087]> SELECT * FROM Taco;
+----+-------+
| pk | data  |
+----+-------+
|  1 | dataA |
|  2 | dataB |
|  3 | dataC |
|  4 | dataD |
|  5 | dataE |
+----+-------+
5 rows in set (0.001 sec)

MariaDB [z1910087]> \t

MariaDB [z1910087]> SELECT * FROM Taco;
+----+-------+
| pk | data  |
+----+-------+
|  1 | dataA |
|  2 | dataB |
|  3 | dataC |
|  4 | dataD |
|  5 | dataE |
+----+-------+
5 rows in set (0.001 sec)

MariaDB [z1910087]> \t

MariaDB [z1910087]> USE z1910087;
Database changed
MariaDB [z1910087]> START TRANSACTION;
Query OK, 0 rows affected (0.000 sec)

MariaDB [z1910087]> DELETE FROM Taco WHERE pk = 3;
Query OK, 1 row affected (0.001 sec)

MariaDB [z1910087]> SELECT * FROM Taco;
+----+-------+
| pk | data  |
+----+-------+
|  1 | dataA |
|  2 | dataB |
|  4 | dataD |
|  5 | dataE |
+----+-------+
4 rows in set (0.001 sec)

MariaDB [z1910087]> UPDATE Taco
    -> SET data = 'Changed'
    -> where pk = 2;
Query OK, 1 row affected (0.001 sec)
Rows matched: 1  Changed: 1  Warnings: 0

MariaDB [z1910087]> UPDATE Taco SET data = 'Changed 2' where pk = 4;
Query OK, 1 row affected (0.001 sec)
Rows matched: 1  Changed: 1  Warnings: 0

MariaDB [z1910087]> INSERT INTO Taco VALUES(6, 'dataF');
Query OK, 1 row affected (0.001 sec)

MariaDB [z1910087]> SELECT * FROM Taco;
+----+-----------+
| pk | data      |
+----+-----------+
|  1 | dataA     |
|  2 | Changed   |
|  4 | Changed 2 |
|  5 | dataE     |
|  6 | dataF     |
+----+-----------+
5 rows in set (0.001 sec)

MariaDB [z1910087]> ROLLBACK;
Query OK, 0 rows affected (0.074 sec)

MariaDB [z1910087]> SELECT * FROM Taco;
+----+-------+
| pk | data  |
+----+-------+
|  1 | dataA |
|  2 | dataB |
|  3 | dataC |
|  4 | dataD |
|  5 | dataE |
+----+-------+
5 rows in set (0.001 sec)

MariaDB [z1910087]> \t
MariaDB [z1910087]> USE z1910087;
Database changed
MariaDB [z1910087]> START TRANSACTION;
Query OK, 0 rows affected (0.000 sec)

MariaDB [z1910087]> USE z1910087;
Database changed
MariaDB [z1910087]> START TRANSACTION;
Query OK, 0 rows affected (0.000 sec)

MariaDB [z1910087]> UPDATE Taco SET data = 'data1A' where pk=1;
Query OK, 1 row affected (0.001 sec)
Rows matched: 1  Changed: 1  Warnings: 0

MariaDB [z1910087]> UPDATE Taco SET data= 'data2B' WHERE pk = 2;
Query OK, 1 row affected (0.001 sec)
Rows matched: 1  Changed: 1  Warnings: 0

MariaDB [z1910087]> UPDATE Taco SET data = 'data5E' WHERE pk = 5;
Query OK, 1 row affected (0.001 sec)
Rows matched: 1  Changed: 1  Warnings: 0

MariaDB [z1910087]> UPDATE Taco SET data = 'data12B' WHERE pk = 1;
ERROR 1205 (HY000): Lock wait timeout exceeded; try restarting transaction
